{
  "schemaVersion": 1,
  "id": "prj_fixture",
  "name": "Fixture",
  "targets": [
    "claude"
  ],
  "contextDocuments": [
    {
      "id": "context.architecture",
      "title": "Architecture",
      "kind": "architecture",
      "content": "Handlers call services; services call repositories. Only repositories touch the database.",
      "audience": "agent",
      "activation": {
        "type": "always"
      },
      "provenance": {
        "sourceFormat": "claude",
        "sourcePath": "CLAUDE.md",
        "sourceHash": "sha256:0652f1aa178b4e4c7e324963d2bb6ea848659d2b2e7c56d055a10fefa9e9e36a",
        "span": {
          "byteStart": 15,
          "byteEnd": 123,
          "lineStart": 3,
          "lineEnd": 6
        },
        "importerVersion": "1",
        "disposition": "parsed",
        "contentHash": "sha256:e3e0ed0aa6c1948843e84c1c616d45d5bcee21ee9f38ad968805356edab3db87"
      }
    },
    {
      "id": "context.commands",
      "title": "Commands",
      "kind": "operations",
      "content": "- `make build` compiles the service.\n- `make test` runs the unit tests.",
      "audience": "agent",
      "activation": {
        "type": "always"
      },
      "provenance": {
        "sourceFormat": "claude",
        "sourcePath": "CLAUDE.md",
        "sourceHash": "sha256:0652f1aa178b4e4c7e324963d2bb6ea848659d2b2e7c56d055a10fefa9e9e36a",
        "span": {
          "byteStart": 123,
          "byteEnd": 208,
          "lineStart": 7,
          "lineEnd": 10
        },
        "importerVersion": "1",
        "disposition": "parsed",
        "contentHash": "sha256:7c4a03a6464999203d107203a64e03404baf95e3214c4470512eb523de820c93"
      }
    }
  ],
  "rules": [
    {
      "id": "rule.api-request-validation",
      "title": "API request validation",
      "instruction": "Validate every request body at the boundary and return problem+json errors.",
      "priority": "must",
      "enabled": true,
      "activation": {
        "type": "path-scoped",
        "include": [
          "src/api/**/*.go",
          "src/handlers/**/*.go"
        ]
      },
      "provenance": {
        "sourceFormat": "claude",
        "sourcePath": ".claude/rules/api.md",
        "sourceHash": "sha256:75de89b76e1c59d5a067279970823154fc38bb99a051acd1f582c1e0b06db065",
        "span": {
          "byteEnd": 218,
          "lineStart": 1,
          "lineEnd": 12
        },
        "importerVersion": "1",
        "disposition": "parsed",
        "contentHash": "sha256:57c456f3d669ad7d0df22c8cb0a5bdfd71f421358d363647b057c6c7dc9b61a0"
      },
      "extensions": {
        "claude": {
          "description": "API request validation",
          "stemma.ruleFile": "api.md"
        }
      }
    },
    {
      "id": "rule.formatting",
      "title": "Formatting",
      "instruction": "Run `gofmt -w .` before committing.",
      "priority": "should",
      "enabled": true,
      "activation": {
        "type": "always"
      },
      "provenance": {
        "sourceFormat": "claude",
        "sourcePath": ".claude/rules/style.md",
        "sourceHash": "sha256:4499ab3997e6acc93b223061dcdc9b818757356c7da5b935b1ef91a2b937990b",
        "span": {
          "byteEnd": 83,
          "lineStart": 1,
          "lineEnd": 8
        },
        "importerVersion": "1",
        "disposition": "parsed",
        "contentHash": "sha256:fb0d77b64b1d00ac88d11a509322caff9b4a8cc9cf9ed51d99852a8cb9c3ff81"
      },
      "extensions": {
        "claude": {
          "description": "Formatting",
          "stemma.ruleFile": "style.md"
        }
      }
    }
  ],
  "procedures": [],
  "skills": [
    {
      "id": "skill.migration",
      "name": "migration",
      "description": "Write and apply a database migration",
      "content": "Create the migration file, then apply it with `make migrate`.",
      "allowedTools": [
        "bash"
      ],
      "provenance": {
        "sourceFormat": "claude",
        "sourcePath": ".claude/skills/migration/SKILL.md",
        "sourceHash": "sha256:e95cc3573d3b5a24e40fa330af8f2cbda7ea91b6f6e8e91c5be868f35fa30c23",
        "span": {
          "byteEnd": 174,
          "lineStart": 1,
          "lineEnd": 10
        },
        "importerVersion": "1",
        "disposition": "parsed",
        "contentHash": "sha256:f86d0563b2c976d083e1e590fcc9598e42891a45cbec9446c6c1977a215d54ff"
      },
      "extensions": {
        "claude": {
          "stemma.sourceDir": "migration"
        }
      }
    }
  ],
  "agents": [
    {
      "id": "agent.reviewer",
      "name": "reviewer",
      "description": "Reviews pull requests for API breakage",
      "instructions": "Review diffs for backwards-incompatible API changes.",
      "tools": [
        "Read",
        "Grep"
      ],
      "modelPreference": "opus",
      "provenance": {
        "sourceFormat": "claude",
        "sourcePath": ".claude/agents/reviewer.md",
        "sourceHash": "sha256:6363faa56cbee70978bf0b53372eeaf9c5176e6c53d1fd6f3a2e1330782b2adf",
        "span": {
          "byteEnd": 161,
          "lineStart": 1,
          "lineEnd": 9
        },
        "importerVersion": "1",
        "disposition": "parsed",
        "contentHash": "sha256:bba0c96718439977b99138f6f3740e682f076188a13f801314caa904f7c73ad8"
      },
      "extensions": {
        "claude": {
          "stemma.sourceFile": "reviewer.md"
        }
      }
    }
  ],
  "decisions": [],
  "extensions": {
    "claude": {
      "stemma.rootFile": "CLAUDE.md"
    }
  },
  "opaqueBlocks": []
}
