{
  "schemaVersion": 1,
  "id": "prj_fixture",
  "name": "Fixture",
  "targets": [
    "kiro"
  ],
  "contextDocuments": [
    {
      "id": "context.api-conventions",
      "title": "API conventions",
      "kind": "other",
      "content": "Validate every request body at the boundary.",
      "audience": "agent",
      "activation": {
        "type": "path-scoped",
        "include": [
          "src/api/**",
          "src/handlers/**"
        ]
      },
      "provenance": {
        "sourceFormat": "kiro",
        "sourcePath": ".kiro/steering/api.md",
        "sourceHash": "sha256:eff65a5ddfc3acace4be9f7be6b4df6a4870313a3e072550d787ec6857a693ec",
        "span": {
          "byteEnd": 146,
          "lineStart": 1,
          "lineEnd": 9
        },
        "importerVersion": "1",
        "disposition": "parsed",
        "contentHash": "sha256:9449ed6c45e48f26bf2c9b940f8894217adbb1174b4d633045e4674855c838c8"
      },
      "extensions": {
        "kiro": {
          "inclusion": "fileMatch",
          "stemma.steeringFile": "api.md"
        }
      }
    },
    {
      "id": "context.incident-response",
      "title": "incident-response",
      "kind": "other",
      "content": "Page the on-call engineer, then open an incident channel.",
      "audience": "agent",
      "activation": {
        "type": "on-demand",
        "trigger": "How to respond to a production incident",
        "invocationName": "incident-response"
      },
      "provenance": {
        "sourceFormat": "kiro",
        "sourcePath": ".kiro/steering/incident.md",
        "sourceHash": "sha256:726c765b15118df49740e4c8a8e75319841b55782aa98a7df529423f4967c8c4",
        "span": {
          "byteEnd": 183,
          "lineStart": 1,
          "lineEnd": 10
        },
        "importerVersion": "1",
        "disposition": "parsed",
        "contentHash": "sha256:ccbbcb9d0d6ed6c947405ee5f69bf4dbf069cc2ea68ed35d366ee78e597f0a5d"
      },
      "extensions": {
        "kiro": {
          "description": "How to respond to a production incident",
          "inclusion": "manual",
          "name": "incident-response",
          "stemma.steeringFile": "incident.md"
        }
      }
    },
    {
      "id": "context.product",
      "title": "Product",
      "kind": "product",
      "content": "Acme Ledger is a double-entry accounting service for small businesses.",
      "audience": "agent",
      "activation": {
        "type": "always"
      },
      "provenance": {
        "sourceFormat": "kiro",
        "sourcePath": ".kiro/steering/product.md",
        "sourceHash": "sha256:1f2b0aea75d4c6748c44f8960d9916659a872f08685e0b39d88345c340eee710",
        "span": {
          "byteEnd": 109,
          "lineStart": 1,
          "lineEnd": 8
        },
        "importerVersion": "1",
        "disposition": "parsed",
        "contentHash": "sha256:227810205e2c508d5888d7145d0707d345b05afc9d8e9233f9536a41b0ccaa7d"
      },
      "extensions": {
        "kiro": {
          "inclusion": "always",
          "stemma.steeringFile": "product.md"
        }
      }
    }
  ],
  "rules": [],
  "procedures": [],
  "skills": [
    {
      "id": "skill.audit",
      "name": "audit",
      "description": "Audit the ledger for imbalanced entries",
      "content": "Run `make audit` and review the report.",
      "provenance": {
        "sourceFormat": "kiro",
        "sourcePath": ".kiro/skills/audit/SKILL.md",
        "sourceHash": "sha256:ce6079905e4535f50533ad01ddbd2fbfcfd1985322a0b139428f97a8039b20d0",
        "span": {
          "byteEnd": 123,
          "lineStart": 1,
          "lineEnd": 9
        },
        "importerVersion": "1",
        "disposition": "parsed",
        "contentHash": "sha256:a043a35e9e3064dd4065659e1590e15aed198460b41af7d2f91cfb13bc23aa0b"
      },
      "extensions": {
        "kiro": {
          "stemma.sourceDir": "audit"
        }
      }
    }
  ],
  "agents": [
    {
      "id": "agent.reviewer",
      "name": "reviewer",
      "description": "Reviews pull requests for API breakage",
      "instructions": "Review diffs for backwards-incompatible API changes.",
      "tools": [
        "read",
        "grep"
      ],
      "provenance": {
        "sourceFormat": "kiro",
        "sourcePath": ".kiro/agents/reviewer.json",
        "sourceHash": "sha256:7db901b24e0b5c6cc568b52649a0d2f05fb884000e4fc93caaae753acecdf9a1",
        "span": {
          "byteEnd": 216
        },
        "importerVersion": "1",
        "disposition": "parsed",
        "contentHash": "sha256:a5cea0c819121e027e9b669f12b04ca463819a80c92b42f449065406deb4b5b9"
      },
      "extensions": {
        "kiro": {
          "resources": [
            "file://src/api"
          ],
          "stemma.instructionsKey": "prompt",
          "stemma.sourceFile": "reviewer.json"
        }
      }
    }
  ],
  "decisions": [],
  "opaqueBlocks": []
}
